A1: # | B1: Last | C1: First | D1: CAT | E1: Home Town | F1: ST | G1: Club | I1: TT Points | J1: Crit #1 Points | K1: RR Points | L1: Crit #2 Points | M1: TOTAL
A2: 1 | B2: Doughty | C2: Tom | D2: 1 | E2: Aurora | F2: IL | G2: US Postal | I2: 19 | J2: 17 | K2: 22 | L2: 19 | M2: =SUM(I2:L2) -> 77
A3: 2 | B3: Raby | C3: Ben | D3: 1 | E3: Geneva | F3: IL | I3: 17 | J3: 12 | K3: 38 | L3: 8 | M3: =SUM(I3:L3) -> 75
A4: 3 | B4: Adamczyk | C4: Martin | D4: 1 | E4: New Carlisle | F4: IN | G4: Long John Silvers | I4: 16 | J4: 16 | K4: 30 | L4: 7 | M4: =SUM(I4:L4) -> 69
A5: 4 | B5: Lister | C5: Trevor | D5: 1 | E5: Carlinville | F5: IL | G5: Long John Silvers | J5: 15 | K5: 36 | L5: 15 | M5: =SUM(I5:L5) -> 66
A6: 5 | B6: Farrell | C6: Mike | D6: 1 | E6: Geneva | F6: IL | G6: ABD | I6: 14 | J6: 14 | K6: 12 | L6: 18 | M6: =SUM(I6:L6) -> 58
A7: 6 | B7: Mead | C7: Bryce | D7: 1 | E7: Rock Falls | F7: IL | G7: Bianchi/GP | I7: 20 | J7: 19 | K7: 18 | M7: =SUM(I7:L7) -> 57
A8: 7 | B8: Reyes | C8: Alfonso | D8: 1 | E8: Bloomington | F8: IL | G8: Proctor | J8: 10 | K8: 24 | L8: 12 | M8: =SUM(I8:L8) -> 46
A9: 8 | B9: Kuttler | C9: Kris | D9: 1 | E9: Chicago | F9: IL | G9: XXX Racing-Athletico | I9: 12 | J9: 2 | K9: 20 | L9: 6 | M9: =SUM(I9:L9) -> 40
A10: 9 | B10: Lister | C10: Andrew | D10: 1 | E10: Carlinville | F10: IL | G10: Proctor | K10: 28 | L10: 10 | M10: =SUM(I10:L10) -> 38
A11: 10 | B11: Jungels | C11: Rob | D11: 1 | E11: Elmhurst | F11: IL | G11: ABD | I11: 15 | J11: 6 | K11: 10 | L11: 3 | M11: =SUM(I11:L11) -> 34

A1: # | B1: Last | C1: First | D1: CAT | E1: Home Town | F1: ST | G1: Club | I1: TT Points | J1: Crit #1 Points | K1: RR Points | L1: Crit #2 Points | M1: TOTAL
A2: 1 | B2: Sparks | C2: Kelly | D2: 3 | E2: Peoria | F2: IL | G2: Proctor | I2: 19 | J2: 20 | K2: 38 | L2: 18 | M2: =SUM(I2:L2) -> 95
A3: 2 | B3: Mosora | C3: Christopher | D3: 3 | E3: Woodridge | F3: IL | G3: Vision Quest | I3: 20 | J3: 18 | K3: 34 | L3: 20 | M3: =SUM(I3:L3) -> 92
A4: 3 | B4: Krueger | C4: Uwe | D4: 3 | E4: Chicago | F4: IL | G4: Vox-Higher Gear | I4: 17 | J4: 17 | K4: 40 | L4: 17 | M4: =SUM(I4:L4) -> 91
A5: 4 | B5: Henry | C5: Timothy | D5: 3 | E5: Lake in the Hills | F5: IL | G5: Project 5 Racing | I5: 11 | J5: 13 | K5: 26 | L5: 15 | M5: =SUM(I5:L5) -> 65
A6: 5 | B6: Klein | C6: Jason | D6: 3 | E6: Palatine | F6: IL | G6: Redline Racing | J6: 14 | K6: 36 | L6: 14 | M6: =SUM(I6:L6) -> 64
A7: 6 | B7: Garcia | C7: Carlos | D7: 3 | E7: Addison | F7: IL | G7: Project 5 Racing | I7: 14 | J7: 19 | L7: 19 | M7: =SUM(I7:L7) -> 52

A1: # | B1: Last | C1: First | D1: CAT | E1: Home Town | F1: ST | G1: Club | I1: TT Points | J1: Crit #1 Points | K1: RR Points | L1: Crit #2 Points | M1: TOTAL
A2: 1 | B2: Widoff | C2: Ben-Jamin | D2: 4 | E2: Woodstock | F2: IL | G2: Hawaiian Pedals | I2: 19 | J2: 16 | K2: 26 | L2: 19 | M2: =SUM(I2:L2) -> 80
A3: 2 | B3: Reyes | C3: David | D3: 4 | J3: 20 | K3: 38 | L3: 17 | M3: =SUM(I3:L3) -> 75
A4: 3 | B4: Monico | C4: Darren | D4: 4 | E4: Palatine | F4: IL | G4: North Branch | I4: 3 | J4: 17 | K4: 36 | L4: 15 | M4: =SUM(I4:L4) -> 71
A5: 4 | B5: Moeller | C5: Marc | D5: 4 | E5: Elgin | F5: IL | G5: North Branch | J5: 13 | K5: 34 | L5: 20 | M5: =SUM(I5:L5) -> 67
A6: 5 | B6: Blander | C6: Benjamin | D6: 4 | E6: Chicago | F6: IL | G6: university of chicago | I6: 12 | J6: 10 | K6: 32 | L6: 10 | M6: =SUM(I6:L6) -> 64
A7: 6 | B7: Paradis | C7: Matthew | D7: 4 | E7: Batavia | F7: IL | G7: QuavR | I7: 17 | J7: 11 | K7: 18 | L7: 12 | M7: =SUM(I7:L7) -> 58
A8: 7 | B8: Riniker | C8: Mark | D8: 4 | E8: Glendale Heights | F8: IL | G8: ABD | J8: 19 | K8: 28 | L8: 11 | M8: =SUM(I8:L8) -> 58
A9: 8 | B9: Peterson | C9: Doug | D9: 4 | E9: Algonquin | F9: IL | G9: Mack | I9: 20 | J9: 6 | K9: 22 | L9: 9 | M9: =SUM(I9:L9) -> 57
A10: 9 | B10: Holton | C10: James | D10: 4 | E10: Chicago | F10: IL | G10: VOX-Higher Gear | I10: 9 | J10: 12 | K10: 14 | L10: 6 | M10: =SUM(I10:L10) -> 41
A11: 10 | B11: Couperus | C11: Ken | D11: 4 | E11: South Elgin | F11: IL | G11: North Branch | I11: 7 | J11: 7 | K11: 12 | M11: =SUM(I11:L11) -> 26
A12: 11 | B12: Ellington | C12: Nathan | D12: 4 | E12: Palatine | F12: IL | G12: Arlington Flyers | I12: 11 | J12: 1 | K12: 8 | L12: 2 | M12: =SUM(I12:L12) -> 22

A1: # | B1: Last | C1: First | D1: CAT | E1: Home Town | F1: ST | G1: Club | I1: TT Points | J1: Crit #1 Points | K1: RR Points | L1: Crit #2 Points | M1: TOTAL
A2: 1 | B2: Waterstraat | C2: Christian | D2: Cmen | E2: Lisle | F2: IL | I2: 20 | J2: 19 | K2: 28 | L2: 15 | M2: =SUM(I2:L2) -> 82
A3: 2 | B3: Schopp | C3: Rick | D3: Cmen | E3: Aurora | F3: IL | G3: Chicago Performance | I3: 8 | J3: 18 | K3: 38 | L3: 16 | M3: =SUM(I3:L3) -> 80
A4: 3 | B4: Kosela | C4: Wojciech | D4: Cmen | E4: Downers Grove | F4: Il | I4: 14 | J4: 14 | K4: 36 | L4: 13 | M4: =SUM(I4:L4) -> 77
A5: 4 | B5: Yurcheshen | C5: Mark | D5: Cmen | E5: Hanover Park | F5: IL | G5: ABC | I5: 5 | J5: 17 | K5: 22 | L5: 19 | M5: =SUM(I5:L5) -> 63
A6: 5 | B6: Tubic | C6: Bisi | D6: Cmen | E6: Naperville | F6: IL | J6: 11 | K6: 34 | L6: 17 | M6: =SUM(I6:L6) -> 62
A7: 6 | B7: Kirkpatrick | C7: Kevin | D7: Cmen | E7: Naperville | F7: IL | J7: 16 | K7: 30 | L7: 11 | M7: =SUM(I7:L7) -> 57
A8: 7 | B8: Fisher | C8: Mauro | D8: Cmen | E8: Chicago | F8: IL | J8: 12 | K8: 26 | L8: 12 | M8: =SUM(I8:L8) -> 50
A9: 8 | B9: Lewandowski | C9: Jim | D9: Cmen | E9: Barrington | F9: IL | G9: QuavR | I9: 7 | J9: 10 | K9: 32 | M9: =SUM(I8:L8) -> 49
A10: 9 | B10: Bielski | C10: Steve | D10: Cmen | E10: Geneva | F10: IL | G10: ABD | I10: 11 | J10: 5 | K10: 24 | L10: 2 | M10: =SUM(I9:L9) -> 42
A11: 10 | B11: Carrillo | C11: Jose | D11: Cmen | E11: Warrenville | F11: IL | I11: 12 | J11: 4 | K11: 6 | L11: 14 | M11: =SUM(I11:L11) -> 36
A12: 11 | B12: Oswald | C12: Wolfgang | D12: Cmen | E12: Dekalb | F12: IL | I12: 13 | K12: 14 | L12: 6 | M12: =SUM(I10:L10) -> 33
A13: 12 | B13: Nevdal | C13: Aaron | D13: Cmen | E13: Dekalb | F13: IL | J13: 16 | K13: 0 | L13: 16 | M13: =SUM(I12:L12) -> 32
A14: 13 | B14: Covone | C14: Chris | D14: Cmen | E14: West Chicago | F14: IL | I14: 10 | J14: 1 | K14: 10 | M14: =SUM(I12:L12) -> 21

A1: # | B1: Last | C1: First | D1: CAT | E1: Home Town | F1: ST | G1: Club | I1: TT Points | J1: Crit #1 Points | K1: RR Points | L1: Crit #2 Points | M1: TOTAL
A2: 1 | B2: Kron | C2: Robert | D2: M40+ | E2: Mount Prospect | F2: IL | G2: Mack | I2: 16 | J2: 20 | K2: 26 | L2: 20 | M2: =SUM(I2:L2) -> 82
A3: 2 | B3: Ramirez | C3: Pedro | D3: M40+ | E3: Glen Ellyn | F3: IL | G3: The Bike Shop | I3: 11 | J3: 19 | K3: 30 | L3: 15 | M3: =SUM(I3:L3) -> 75
A4: 3 | B4: Kerr | C4: Andy | D4: M40+ | E4: Streamwood | F4: IL | G4: Redline Racing | J4: 18 | K4: 38 | L4: 14 | M4: =SUM(I4:L4) -> 70
A5: 4 | B5: Doering | C5: Gary | D5: M40+ | E5: Springfield | F5: IL | G5: Mack | J5: 13 | K5: 40 | L5: 16 | M5: =SUM(I5:L5) -> 69
A6: 5 | B6: Kurtz | C6: Michael | D6: M40+ | E6: Lisle | F6: IL | G6: Gladiators | I6: 10 | J6: 8 | K6: 22 | L6: 13 | M6: =SUM(I6:L6) -> 53
A7: 6 | B7: Saha | C7: Henry | D7: M40+ | E7: Mt.Prospect | F7: Il | G7: BBC | I7: 12 | J7: 10 | K7: 24 | M7: =SUM(I7:L7) -> 46
A8: 7 | B8: Dial | C8: Chris | D8: M40+ | E8: Milwaukee | F8: WI | G8: Mid South Velo | J8: 9 | K8: 18 | L8: 17 | M8: =SUM(I8:L8) -> 44
A9: 8 | B9: Doughty | C9: Tom | D9: M40+ | E9: Aurora | F9: IL | G9: US Postal | I9: 17 | J9: 17 | L9: 9 | M9: =SUM(I9:L9) -> 43
A10: 9 | B10: Van | C10: Brian | D10: M40+ | E10: Sycamore | F10: IL | G10: Mack | I10: 9 | J10: 1 | K10: 16 | M10: =SUM(I10:L10) -> 26

A1: # | B1: Last | C1: First | D1: CAT | E1: Home Town | F1: ST | G1: Club | I1: TT Points | J1: Crit #1 Points | K1: RR Points | L1: Crit #2 Points | M1: TOTAL
A2: 1 | B2: Demel | C2: Ziggy | D2: M50+ | E2: Chicago | F2: IL | G2: Redline Racing | I2: 19 | J2: 19 | K2: 30 | L2: 16 | M2: =SUM(I2:L2) -> 84
A3: 2 | B3: Campbell | C3: Gary | D3: M50+ | E3: Naperville | F3: IL | G3: ABD | I3: 20 | J3: 15 | K3: 24 | L3: 20 | M3: =SUM(I3:L3) -> 79
A4: 3 | B4: Kusal | C4: Longin | D4: M50+ | E4: Norridge | F4: IL | J4: 17 | K4: 40 | L4: 19 | M4: =SUM(I4:L4) -> 76
A5: 4 | B5: Adamczyk | C5: Richard | D5: M50+ | E5: South Bend | F5: IN | I5: 7 | J5: 18 | K5: 38 | L5: 13 | M5: =SUM(I5:L5) -> 76
A6: 5 | B6: Weil | C6: Tom | D6: M50+ | E6: Naperville | F6: IL | G6: Cycle Veloce | I6: 18 | J6: 14 | K6: 26 | L6: 17 | M6: =SUM(I6:L6) -> 75
A7: 6 | B7: Conway | C7: Dan | D7: M50+ | E7: Chicago | F7: IL | G7: Prairie Scorchers | I7: 16 | J7: 16 | K7: 22 | L7: 14 | M7: =SUM(I7:L7) -> 68
A8: 7 | B8: O'Dell | C8: Scott | D8: M50+ | E8: Lake Barrington | F8: IL | G8: Verge.Com | I8: 15 | J8: 13 | K8: 28 | L8: 12 | M8: =SUM(I8:L8) -> 68
A9: 8 | B9: Reid | C9: Brad | D9: M50+ | E9: Normal | F9: IL | G9: Mack | I9: 14 | J9: 10 | K9: 32 | L9: 7 | M9: =SUM(I9:L9) -> 63
A10: 9 | B10: Potylicki | C10: Ziggy | D10: M50+ | E10: Downers Grove | F10: IL | G10: ABD | I10: 6 | J10: 8 | K10: 20 | L10: 5 | M10: =SUM(I10:L10) -> 39
A11: 10 | B11: O'Shea | C11: Eugene | D11: M50+ | E11: Naperville | F11: IL | I11: 8 | J11: 11 | L11: 10 | M11: =SUM(I11:L11) -> 29
A12: 11 | B12: Stern | C12: Alan | D12: M50+ | E12: Chicago | F12: IL | G12: Velo Club Roubaix | I12: 4 | J12: 7 | K12: 16 | L12: 2 | M12: =SUM(I12:L12) -> 29

A1: # | B1: Last | C1: First | D1: CAT | E1: Home Town | F1: ST | G1: Club | I1: TT Points | J1: Crit #1 Points | K1: RR Points | L1: Crit #2 Points | M1: TOTAL
A2: 1 | B2: Gruner | C2: Claus | D2: M60+ | E2: Gurnee | F2: IL | G2: GCR | J2: 5 | K2: 10 | L2: 4 | M2: =SUM(I2:L2) -> 19
A3: 2 | B3: McGovern | C3: Garry | D3: M60+ | E3: Barrington | F3: IL | G3: Redline Racing | I3: 4 | J3: 4 | K3: 6 | L3: 2 | M3: =SUM(I3:L3) -> 16

A1: # | B1: Last | C1: First | D1: CAT | E1: Home Town | F1: ST | G1: Club | I1: TT Points | J1: Crit #1 Points | K1: RR Points | L1: Crit #2 Points | M1: TOTAL
A2: 1 | B2: Burns | C2: Robert | D2: M65+ | E2: Little Torch Key | F2: FL | G2: Mack | I2: 5 | J2: 4 | K2: 10 | L2: 5 | M2: =SUM(I2:L2) -> 24
A3: 2 | B3: Patterson | C3: Jack | D3: M65+ | E3: Morton | F3: IL | G3: Midwest Masters | I3: 3 | J3: 5 | K3: 8 | L3: 4 | M3: =SUM(I3:L3) -> 20
A4: 3 | B4: Wachholz | C4: William | D4: M65+ | E4: Winfield | F4: IL | G4: ABD | I4: 1 | J4: 2 | K4: 6 | L4: 2 | M4: =SUM(I4:L4) -> 11
A5: 4 | B5: Krehbiel | C5: John | D5: M65+ | E5: Lake Forest | F5: IL | G5: Midwest Masters | I5: 2 | J5: 3 | L5: 3 | M5: =SUM(I5:L5) -> 8

A1: # | B1: Last | C1: First | D1: CAT | E1: Home Town | F1: ST | G1: Club | I1: TT Points | J1: Crit #1 Points | K1: RR Points | L1: Crit #2 Points | M1: TOTAL
A2: 1 | B2: Burnham | C2: Cathy | D2: W1/2/3 | E2: Bartlett | F2: IL | G2: ABD | I2: 5 | J2: 5 | K2: 10 | L2: 5 | M2: =SUM(I2:L2) -> 25
A3: 2 | B3: Heck | C3: Vicki | D3: W1/2/3 | E3: Hanover Park | F3: IL | G3: ABD | I3: 4 | J3: 4 | K3: 8 | L3: 4 | M3: =SUM(I3:L3) -> 20
A4: 3 | B4: Richards | C4: Sheri | D4: W1/2/3 | E4: Crystal Lake | F4: IL | G4: ABD | I4: 3 | J4: 2 | K4: 2 | L4: 1 | M4: =SUM(I4:L4) -> 8

A1: # | B1: Last | C1: First | D1: CAT | E1: Home Town | F1: ST | G1: Club | I1: TT Points | J1: Crit #1 Points | K1: RR Points | L1: Crit #2 Points | M1: TOTAL
A2: 1 | B2: Palmquist | C2: Christine | D2: W4 | E2: Geneva | F2: IL | G2: QuavR | I2: 5 | J2: 4 | K2: 8 | L2: 5 | M2: =SUM(I2:L2) -> 22
A3: 2 | B3: Broaddus | C3: Renee | D3: W4 | E3: Barrington | F3: IL | G3: Team BBC | J3: 5 | K3: 10 | L3: DNF | M3: =SUM(I3:L3) -> 15
A4: 3 | B4: Richards | C4: Sheri | D4: W4 | E4: Crystal Lake | F4: IL | G4: Active Endeavors | I4: 3 | J4: 2 | L4: 4 | M4: =SUM(I3:L3) -> 9

A1: # | B1: Last | C1: First | D1: CAT | E1: Home Town | F1: ST | G1: Club | I1: TT Points | J1: Crit #1 Points | K1: RR Points | L1: Crit #2 Points | M1: TOTAL
A2: 1 | B2: Myslis | C2: Mary | D2: W40+ | E2: Libertyville | F2: IL | G2: Bike Club Lake County | I2: 5 | J2: 4 | K2: 8 | L2: 5 | M2: =SUM(I2:L2) -> 22
A3: 2 | B3: Fagan | C3: Mimi | D3: W40+ | E3: Belvidere | F3: IL | G3: Lightning Bolt | I3: 4 | J3: 3 | K3: 6 | L3: 4 | M3: =SUM(I3:L3) -> 17
A4: 3 | B4: Schurman | C4: Regina | D4: W40+ | E4: Lisle | F4: IL | G4: Apache | I4: 3 | J4: 2 | K4: 4 | L4: 3 | M4: =SUM(I4:L4) -> 12

A1: # | B1: Last | C1: First | D1: CAT | E1: Home Town | F1: ST | G1: Club | I1: TT Points | J1: Crit #1 Points | K1: RR Points | L1: Crit #2 Points | M1: TOTAL
A2: 1 | B2: Beam | C2: Patricia | D2: W60+ | E2: Caledonia | F2: IL | G2: Lighting Bolt | I2: 5 | J2: 5 | K2: 10 | L2: 5 | M2: =SUM(I2:L2) -> 25